{"$schema":"https://json-schema.org/draft/2020-12/schema","$id":"urn:an-kla:schema:provenance-manifest:v1","title":"AN-KLA BenchmarkProvenance v1","type":"object","additionalProperties":false,"required":["schema","corpus_sha256","source_kind","sanitization","forbidden_content","source_specific_denylist","human_review","scanner"],"properties":{"schema":{"const":"an-kla/provenance-manifest-v1"},"corpus_sha256":{"$ref":"#/$defs/digest"},"source_kind":{"const":"local-untrusted-memory-sanitized/v1"},"sanitization":{"type":"object","additionalProperties":false,"required":["method","retains_verbatim_source"],"properties":{"method":{"const":"manual-paraphrase/v1"},"retains_verbatim_source":{"const":false}}},"forbidden_content":{"const":["hashes","ids","logs","paths","quotes","urls","usernames"]},"source_specific_denylist":{"type":"object","additionalProperties":false,"required":["location","required_before_publication"],"properties":{"location":{"const":"operator-local-not-versioned"},"required_before_publication":{"const":true}}},"human_review":{"oneOf":[{"type":"object","additionalProperties":false,"required":["status","corpus_sha256","reviewer"],"properties":{"status":{"const":"pending"},"corpus_sha256":{"$ref":"#/$defs/digest"},"reviewer":{"type":"null"}}},{"type":"object","additionalProperties":false,"required":["status","corpus_sha256","reviewer"],"properties":{"status":{"const":"passed"},"corpus_sha256":{"$ref":"#/$defs/digest"},"reviewer":{"const":"maintainer"}}}]},"scanner":{"type":"object","additionalProperties":false,"required":["status","tool","configuration_sha256"],"properties":{"status":{"enum":["pending","passed","failed"]},"tool":{"const":"check_benchmark_corpus/v1"},"configuration_sha256":{"$ref":"#/$defs/digest"}}}},"$defs":{"digest":{"type":"string","pattern":"^sha256:[0-9a-f]{64}$"}}}
