{"corpus_sha256":"sha256:f7738e6b5d05915a2d85c68dbe474667f0fac8e89698018e48d7fd0e11764aba","forbidden_content":["hashes","ids","logs","paths","quotes","urls","usernames"],"human_review":{"corpus_sha256":"sha256:f7738e6b5d05915a2d85c68dbe474667f0fac8e89698018e48d7fd0e11764aba","reviewer":null,"status":"pending"},"sanitization":{"method":"manual-paraphrase/v1","retains_verbatim_source":false},"scanner":{"configuration_sha256":"sha256:4b98ae5dd3d5187627096e74ac394fce6a05f4ff65b87f45d888aebca4234e5d","status":"passed","tool":"check_benchmark_corpus/v1"},"schema":"an-kla/provenance-manifest-v1","source_kind":"local-untrusted-memory-sanitized/v1","source_specific_denylist":{"location":"operator-local-not-versioned","required_before_publication":true}}
